Date,Day,Events,Weather_High,Weather_Low,Weather_Condition,Event_Multiplier,Weather_Multiplier,Total_Revenue,Grant_Park_North,Grant_Park_South,Millennium,Lakeside
2025-08-05,Tuesday,"Millennium Park Summer Film Series:
My Best Friend’s Wedding; Death Cab for Cutie; Parade",82.98,70.38,few clouds,1.10,0.970,46562,15831,6421,3725,9459
2025-08-06,Wednesday,Joshua Bell and Tchaikovsky Romeo & Juliet; Men I Trust; Summer Fireworks; Free Admission Evening,85.55,65.75,clear sky,1.30,0.970,42811,19353,7849,4554,11564
2025-08-07,Thursday,"Millennium Park Summer Music Series Ends:
Ten City
Caramelo Haze
DJ Emmaculate; Wait Wait… Don’t Tell Me!",89.26,71.64,broken clouds,1.20,0.970,121448,20106,8155,4731,12014
2025-08-08,Friday,Live On the Lake!; Stravinsky Firebird,94.15,75.2,broken clouds,1.30,0.970,95492,22374,9074,5265,13369
2025-08-09,Saturday,"Aerial Arts Society presents
The Northern Mid-West Regional Aerial Competition; Herb Alpert & The Tijuana Brass & Other Delights; Stravinsky Firebird; Chicago Fire FC vs. Los Angeles Football Club; Jeezy; Summer Fireworks; Millennium Park Summer Workouts",93.87,72.81,few clouds,1.30,0.970,102461,30521,12378,7181,18237
2025-08-10,Sunday,Preseason: Miami Dolphins vs. Chicago Bears,80.67,76.68,few clouds,1.30,0.970,76208,29060,11786,6838,17364
2025-08-11,Monday,Broadway In Chicago Summer Concert 2025,80,66,partly cloudy,1.40,1.000,126095,21869,8869,5146,13067
